,text,threat
2423,"a arbcom email list read recent request inform topic elsewher wikipedia know victim kangaroo court find troubl off-wiki deliber vehicl formal (secretly?) exist believ """"e-mail list deliber mention arbcom procedur polici page thank bring attent ... a",0
2424,sure concern re fossil fuels/altern energi sourc pollut environment concern includ mention anim right,0
2425,cd peter wagner pleas see talk:c. peter wagner hi ppd repli there,0
2426,thank you look forward work everyon,0
2427,time engag person attack though threat could certain constru one addit recent vandal edit war fred singer articl violat mention polici well wp:npov clear attempt creat coat rack articl continu ignor polici abus administr status seek arbitr,0
2428,a wp:canvass hi a,0
2429,"a his offend use word """"nonsense"""". endeavour write balanc accur piec believ made reason success it given work consid """"nonsense"""" contributor firm believ contribut nov contribut frank perhap might avoid use nonsens welcom user a",0
2430,metalwork punk genr fuck idiot type metal god stay websit go spread retard around jumbuck,0
2431,leav alon keep stalk me??? get yourself leav alon quit post messag talk want anyth give shit whatev articl feel obsess compel edit want goddess leav alon,0
2432,comment concern woman concern size peni rather size partner think outrag comment perhap ambigu word of jan dutch,0
2433,biggest screwjob we histori canada other screw canadian let go especi bret hart let go,0
2434,swear person attack toward put good posit either especi sinc initi start argu you anyway hangingcurve/blueboy anyth you,0
2435,"his bennet thank unearth need disambigu think caesura usual spell tax barbuda final letter  (manr). come front root  (naara) mean help make victori interest deriv form ii mean christianize'). therefor  (manr) mean helped', supported', victorious'. place name feminin version this perhap repres old accus with locat mean arab mani place name begin definit articl sometim articl kept transliter sometim not sometim transliter al sometim elk word could transliter mansura, mansoura, mansoora, mansurah, mansourah, mansoorah, mansureh, mansoureh, mansooreh. would make sens altern without altern definit articl link disambigu page howev egyptian mansurah far import these might take preced disambig. see tidi littl a",0
2436,a note editor hard unbias editor case extrem bias one-sid point view sra topic obvious sra talk page we requir report topic extent tone equival mainstream view topic discuss emphasi credibl realiti sra keep major belief sra discredit embarrass part is discuss death archiv agre polici neutral point view welcom contribut anoth onlin venu elsewher may well serv review administr noticeboard a sra topic mainstream interest page place emphasi sourc text give impress sra perceiv anyth except moral panic flu to cd rule a simpl rule of point view ignor larg portion research promot view extremist moreschi excus administr action matter due strong prov counter mine shown abov clear conflict interest a,0
2437,person creat page thank work get articl go sound like interest film pleas note realli easi way creat intern link within wikipedia add two bracket one either side word want link good luck futur edit,0
2438,yeah good talk coach way nice instagram pic a,0
2439,john harrington anyon gather much inform him deal day day basi would like start project anyon interested?...,0
2440,"a much money exchang interview interview construct conflict prison offic pasco claim fire shot kill dodson opinion nun ryan longer want live nun psychologist could possibl come conclus obvious seem aryan execut state-assist suicid relat alleg confess ryan actual say shot dodson alleg said shot wing kill ryan obvious extrem confus mental state a person would prior kill govern could talk past kangaroo shoot event event matter all mental confus person talk ration manner besid nobodi els close ryan claim longer want live none aryan famili member claim said thing case person state longer wish live immedi evalu mental ill so psychiatrist call treat ryan possibl mental disord depress suicid thought push execut ryan mental unstabl henc longer want live legal profession confirm alleg confess alleg herbal legal accept evid guilt"""". mani prison later acquit murder alleg herbal confess must scientif forens evid prove guilt beyond reason doubt aryan case none a noth make aftermath alleg ryan decad execut cannot defend himself vile immor uneth complet mockeri justic system dead ryan innoc famili member polic corrupt uncov various australian royal commiss enough question valid aryan alleg herbal would ryan make alleg confess eleventh-hour write various peopl state emphat guilti murder addit father bosnian put end aftermath unproven unconfirm alleg februari a interview abc nation radio short death father bosnian alway believ ryan innoc ... a",0
2441,a done clear chang want made pleas mention specif chang chang a you format a {{you|}} be a a cd a,0
2442,"a one addit mustafaa, promis much stuff busi late one thing stick could fix quick begin invas yes fault ad argo incid make sound main reason invas cours wrong so sentenc on of israel invad lebanon respons attempt assassin isra ambassador solomon argo abut tidal london june ."""" expand quicki list basic fact israel bomb lebanon/plo month air sea land prepar invas see below could pull invas matter day otherwis attempt assassin solomon argo ... assassin attempt use begin impetus shortcut knesset debat move lebanon without full approv israel invad a troop post link add explan need of dec (utc)""",0
2443,"a even sure idol season a surnam floortj a ellen along jay stage name contest full name that know of encourag peopl make page them come across anoth surnam sure add it vilifi idol cannot vilifi """"ellen"""" would point look idol mention a",0
2444,"day input either side prod go ahead remov prod myself shame user comment talk page maplesim, know go here remov prod hope user come page orangemike, place notabl asid think articl written nov could post wikipedia would possibl perform edit request continu debat meanwhil thank you",0
2445,thank much want appreci this never mention one peopl reason excel contributor encyclopedia help sometim whitmor whitmor talk a,0
2446,two ugli sister land get lost two got harass someon els,0
2447,"of juli dutch would say good statement unblock howev fair use polici unlik bend whim singular group rewritten conform decre wikipedia foundat board truste tri figur autoblock, tool () of",0
2448,lithuanian painter ok them thin refer non english speaker probabl get afd'd.,0
2449,"a differ scale nomin form nation regist histor place professor edward by wilkin wrote the design model tower wind athen proport though reduc scale,"""" think remark differ scale relev paragraph architectur a a",0
2450,"a vase demirjian, castro support tri eras thing sure item address eras feel jigue"""" of a",0
2451,"a hope even intern retain titl read explan abov per riata standard airport qualifi intern look like union govern pressur wmk given airport """"international"""" status bare even qualifi it a talk a",0
2452,"a copyright problem helvetia pennsylvania hello welcom wikipedia welcom appreci contribut helvetia pennsylvania regret cannot accept copyright text imag borrow either web site print materi articl appear contain materi copi miner doublehous karen bescher metheny, therefor constitut violat wikipedia copyright polici copyright text soon delet appreci contribut must requir contributor understand compli copyright polici wikipedia take copyright violat serious persist violat liabl block edit believ articl copyright violat permiss copyright holder releas content freeli licens allow wikipedia one follow permiss author releas text creativ common attribution-sharealik licens (cc-by-sa), leav messag explain detail talk:helvetia, pennsylvania send email confirm permiss """"permissions-en at wikipedia dot org"""". make sure quot exact page name helvetia pennsylvania email see wikipedia:request copyright permiss instruct note origin websit state refus permit under creativ common attribution-sharealik licens (cc-by-sa), version of materi releas public domain leav note talk:helvetia, pennsylvania link find note copyright materi send email address associ origin public permissions-en(at)wikimedia(dot)org postal messag wikipedia foundat permit refus creativ common attribution-sharealik licens gnu free document licens note done talk:helvetia, pennsylvania see wikipedia:don copyright materi instruct may also necessari text modifi encycloped tone follow wikipedia articl layout inform wikipedia polici see wikipedia polici guidelin would like begin work new version articl may a temporari page leav note talk:helvetia, pennsylvania say done administr move new articl place issu resolv thank you pleas feel welcom continu contribut wikipedia happi edit a",0
2453,concern attempt edit-war content articl clear consensus or matter wp:medrs.,0
2454,"chechen involv ad chechen fighter infobox, would foreign mujahideen consid differ also ad hezbollah flag a april",0
2455,user talk:... thank experi wikipedia test work revert remov pleas use sandbox test may want do take look welcom page learn contribut encyclopedia,0
2456,go list hundr edit made past sever month make sure none get miss identifi,0
2457,sam congo live hello notic categor sam congo live person abl find much initi burst popular mission school work vogu is earli is needl say record part africa exact great sourc verifi mr congo inde aliv thank,0
2458,free download bot http://www.fagexautofighter.tk,0
2459,user talk page unita feel free leav messag quir get back soon talk page leav note page,0
2460,"a invit wikiproject brand of style=""""border-spacing:px; margin:px"""" width=""""%"""" of class=""""mainpagebg"""" style=""""width: of border:px solid black background-color:#fff; color:#fff;font-size: %""""| of width=""""%"""" cellpadding="""""""" cellspacing="""""""" style=""""background-color:#dfff"""" a hello bzweebl. invit join wikiproject brand wikiproject resourc dedic improv wikipedia coverag brand brand-rel topic join project add name member list talk of a",0
2461,republ texa texa navi think texa ad countri also navi,0
2462,"may typic a hero shout shazam', pound cane floor sort weird plot devic two third involv bad guy attempt steal special item definit captain power go suggest ad captain power soldier futur sever comment see issu definit take john carter a normal human mar lighter graviti super hero free marvel comic same equip a conman superhero captain power captain power realli superhero conan cours superhero talent killer all realli superhero",0
2463,a readi maci articl focus citi section a,0
2464,dutch a kind talk cannot edit page peopl fail take serious suffer consequ seem understand achiev aim get way of septemb,0
2465,intend justic everyon wikipedia glad saw hybrid make irrelev remark undertak talk page nowher bottom page check lonelyboy histori see work hard edit page christian debat hybrid sandman began pick tell immedi block say not never utter death threat decemb far see scroll page write block zip address month cannot block zip address indefinit given user utter death threat claim everi intent continu attack wikipedia block seem reason yama,0
2466,"i read articl first time yesterday agre languag articl encycloped tone made laugh loud sever place probabl suppos to even sourc use kind languag consid best write practic vast improv exampl would nelson legitim child singl box section titl """"children"""", would one sire wedlock includ one georgeann crew actual entir section child paragraph actual mention place entir section emphas them kris nelson describ make love ron reagan nelson describ """"cavorting"""" two la ram cheerlead paragraph euphem need replac simplest term have sex"""". she hellbent take everyth possibl could leav rick ruined."""" good gracious need quot biograph someth accord biograph john que gossipmonger... agre much written nelson volatil relationship see bear career notabl perform necessari know blair cocaine-user, shoplift nelson famili disapprov relationship bear reader understand notabl say detail various affair hidden articl make seem if perhap like hugh hefner ricki nelson a notabl affair job made famous overlook articl amount emphasi place music career place person life actual somewhat le get impress relat nelson hand write articl perhap progeni direct involv court case among nelson harmoni if fact best reliabl sourc assert nelson affair actual import perform career quot statement come good sourc wrote roy orbison articl understand issu sourc write """"juicy"""" part subject life one biographi use rather determin place undu frank odd emphasi writer view orbison hapless underachiev trip fame accid book design paint mediocr guy extraordinari circumst orbison life nowher near vibrant sexual ricki nelson an impress realli back articl biograph slip shock titbit artist reason explain part patsi cline found warplan accid wikipedia editor weed wife biographi stick fact a",0
2467,... https://en.wikipedia.org/w/index.php?title=talk:deep_space_industries&different;=prev&oldid;=,0
2468,pleas stop ad nonsens wikipedia consid vandal would like experi use sandbox thank you '''',0
2469,eyesor fuck hard eyesor,0
2470,everyth state fall categori origin research take event assum behind them do reliabl sourc give newdow lawsuit this mean pleas bring discuss otherwis fill gap ourselv belong page,0
2471,"a civil futur pleas refrain refer editor """"untrusted"""". editor mean consid untrustworthi account minor chang warrant negat label a a",0
2472,march dutch what go ahead remov it of,0
2473,may concern true heard whatev billion peopl earth need to twp work way meant to howev heard twp editor interest issu result consensus major regard section contain said person attack inappropri twp certain persuas logic respond well bulli taunt enough said,0
2474,"a mainstream scienc ignor research in mainstream scientist not except research time overwhelm major research done hand peopl tie mum org ii virtual none ever get cite research again small circl tm-sponsor research reread upset specif warn googl news googl scholar appropri propos a tri weigh relat promin one propos metric research portion articl use studi per wp:medr regard reliabl a would hand metastudi publish peer-review journal done job editor frank incap a determin """"hundreds"""" peer review studi medit proper conduct appropri document ass whether show anyth signific and happi stand edit histori achiev consensus wherev whenev editor actual interest consensus a",0
2475,sure goodnight a,0
2476,"a also say top suggestbot post page current run studi effect ad addit inform suggestbot recommend particip studi voluntari wish particip studi question concern find contact inform consent inform sheet ad inform readership qualiti suggest articl use low/medium/high scale readership scale go low high a qualiti scale go low high a howev contact inform consent inform sheet dead never consent part """"study"""". a",0
2477,"a """"abstractionism"""" distinct mean the principl practic creat abstract art the present idea abstract manner impress look around clear need articl abstract philosophi http://www.philosophyideas.com/files/papers/geach%on%abstraction.pdf http://.../~phanna/classes/ling/autumn/web/webnotes/sept/node.html http://www.calstatela.edu/faculty/tbettch/handouttwo.htm http://www.authorama.com/meaning-of-truth-.html tire right ferret exact bar sourc definit seem justif full articl dictionari definit need reachabl here need pointer relev articles/sect art philosophi exist content must preserv appropri place a",0
2478,tinker littl linguist think use dutch contribut articl anyth could confus dutch linguist quot ancient arabian script map look lot better,0
2479,imag use polici his remov two imag digit watermark :image:bharatanatyam_.jpg :image:bharatanatyam_.jpg perhap imag without watermark wikipedia imag file could use here talk,0
2480,"a author remarqu pm robinson of jan sofia see kim y.-c.; chan key law gunther do by affiliation:aa(yal univers ab(yal univers ac(yal univers ad(yonsei univers ae(hong kong univers scienc a technolog af(saint martyr univers canada public american astronom societi meet a #.; bulletin american astronom societi vol a pm public date:tab/ research size number betelgeus convect cell possibl use current research section"""". abstract ad articl ???? |-valign=""""top"""" a relev a remarqu |title:tabth scale granul red giant atmospher",0
2481,my silli oversight,0
2482,valuat one light valuat short sale bond,0
2483,dare mention page like one coward countri recogn abkhazia south ossetia ignor recogn kosovo noth cruel person know what care bank kill me care report author for whoever charg wikipedia ill tell protect friend rude me again want me later regret it victim,0
2484,get rid state would huge leap forward toward peac troubl free world,0
2485,"a sure etymolog word much it idea religi polic pretti common one level anoth almost islam countri take various form depend govern decid do natur religious-theocrat govern like full branch polic even group take incarn saudi arabia compar villag enforc group found northern pakistani villag instanc version egypt yemen at least point make sure version islam practic state-sponsor one overal fact remain mani islam nation religi polic form anoth leav fact institut uniqu saudi arabia inaccur claim """"only"""" exist saudi arabia iran a",0
2486,empti one template:us australian english it talk,0
2487,"a hummus definit hello gwen notic alter histori ingredi (http://en.wikipedia.org/wiki/hummus) back palestin problem sinc term """"palestine"""" exist yet time fact would le mistak write canaan even israel sinc predat """"palestine"""". way avoid anachron polit sway would state they eaten peopl today israel palestinian territories...""""""",0
2488,a adopt accept offer adopt thing is abl help start today studi state test school help come back talk page see help:talk page also welcom box read sometim cheer a,0
2489,"a time magazin articl read articl cite use []. wonder say st john amongst best cathol school read articl state a half-dozen school besid note dame outstanding,"""" half dozen georgetown holi cross fordham, st laius boston colleg cathol univers list school a number cathol school fall mass-product good-smal categori st john list correct statement time also consid st john one best cathol univers nation sinc statement incorrect ... read articl care ad inform premis articl top cathol schools,"""" explicit say """"st. john univers one top cathol school nation,"""" impli list st john would it a a cd use origin research impli articl say say all even believ impli that st john section mass product good small categori number school afterward give number student have ... titl articl best cathol colleges,"""" hard origin research a a cd understand say mind take st john talk page get red opinion where outsid individu make opinion it ... sure would help i'm /'' cd a",0
2490,a favor... hello a think realli great editor so think could sign autograph book mayb would honor did see yea later a not sinc mani delet pleas visit wikiasite:guestbook sort thing a tobia conrad notic edit articl read repli see edit anyth disrupt prov push block cwm project ask wise push communiti ban him consid mess articl would wp:coi ban him leav peopl decid a bug.wikipedia his angela saw clean bug.wp day ago pleas could again tag mani articl delet templat most contain singl use word pleas block vandal account (:bug:user:spreeum). thank advanc talk spree seem made one edit a silli test page think serious enough bother block unless warn continu it a wow realli fast thank you of yes right edit there hope stay one... talk wikipedia week notif friend remind wikipedia week releas new episode..... a decid avoid direct link audio file attempt prevent sort audio format war download whichev version want we doggi map mac site direct download episod http://wikipediaweekly.com////wikipedia-weekly-/ alway download old episod http://wikipediaweekly.com/! pleas spread word wikipedia week tri spread word peopl know project got cool guest line make much fun peopl tune in rest wikipedia week crew reliev messag list wikipedia:wikiproject wikipediaweekly/deliveri a wish reliev notif pleas remov list autograph page saw messag annafoxlov talk page tell me think done autograph book probabl sound zealous would like see delet seem use wikipedia sure subspac help wikipedia much least use autograph book sound like sort thing sign go fanci restaur show ate not brilliant analog reason comment sinc launch altern site autograph book reason strong suspect delet wikipedia a me a copyright infringement... wikial wiki yes wiki project blatant steal wikipedia logo now sinc everi time find someon illeg use logo pleas remov it trademark sect sect obvious co,0
2491,a ictus {{prod}} templat ad articl ictus suggest delet accord propos delet process contribut appreci articl may satisfi wikipedia criterion inclus delet notic explain see also what wikipedia not wikipedia delet polici may contest propos delet remov updat prod notic pleas explain disagre propos delet edit summari talk page also pleas consid improv articl address issu rais even though remov delet notic prevent delet propos delet process articl may still delet match speedi delet criterion sent articl delet may delet consensus delet reach endors delet articl person made substanti edit page pleas tag a a a,0
2492,like time valuabl a final respons continu insert text abus remov time complet ignor request citat invalid a provid spurious rational a straw man argument a,0
2493,a refer nicen creed compact clear simpli refer protestant catholic a die christian context mormon aros contend with make clear make appear though vast major christian somehow repres,0
2494,sweden non religi articl sweden say countri a lutheran articl pretti incorrect correct bit could find china,0
2495,user:azatoth/salt.j ad wp:twinkl collect feel free revert it set script all find use sure other would well a,0
2496,"a rastamen? moorish scienc templ member call """"soldiers"""", religion said combin judaism islam christian rastafarian ... a",0
2497,problem somebodi els block him thought myself decid warn would enough move undo block though talk,0
2498,clean due various issu note header plan delet inform articl without sourc next month word want stay find sourc then a talk,0
2499,alreadi repair that,0
2500,"modifi addison current solut merg hover text descript complic note version ref howev refer literatur bit tricki would like need help possibl integr run number idea far creat three-step version link disturb new layout although easier type view sourc show run number shortcut name sourc a option info hover descript click templat take second templat contain refer detail construct similar show run number shortcut name sourc option materi defin trick code link sever note third templat contain specif info sourc date isbn, etc trick is maintain printabl refer system improv link through think differ version two step exampl problem use difficult print version use short possibl templat instead usual ref make easier distinguish text",0
2501,anonym user mysteri figur,0
2502,"a realli pick bad exampl there murder immor fact a self-evid truth cultur point histori and yes cultur situat held respons control tangent a truth statement irrelev section remov appar violat wikipedia strict polici origin research find reput academ studi journal articl support point view add section back citat mere person opinion analysi place encyclopedia littl world truli """"self-evident"""". talk a",0
2503,actual mention and sourc later articl open articl need correct,0
