,text,threat
1460,yup refer arbitrari break mention subsect clear,0
1461,everyon abl read nipa wikipedia cannot either educ get fuck here cannot use spell pronunci pronunci depend nativ dialect person read it australian pronounc spell pronunci differ american will get it cannot use spell pronunci unless speaker one dialect will read it case wikipedia must use ipad,0
1462,talk vatu articl said non free imag there,0
1463,a got it repli a a a,0
1464,"a possibl unfre file:ajvdelft.jpg imag upload alter file:ajvdelft.jpg, list wikipedia:poss unfre imag copyright status unclear disput imag copyright status cannot verifi may delet may find inform imag descript page welcom add comment entri discuss interest delet thank you a a a a a",0
1465,know wait minut want say know better think so stop edit page a not me ruin pages!!!! shut fuck let edit page like know liar edit tuna singer page a eras wrote problem -rondakalitus-,0
1466,record anyon name jewish prolin organ even credibl mention thing exist immedi remov sentenc claim ani minor issu easili settl relianc sourc,0
1467,gregg berhalt last real user come behind zip address think rant suppos neutral summari posit indic failur follow wikipedia polici again stubborn refus offer concret altern demonstr bad faith,0
1468,"apprantly, anoth user brought page back",0
1469,"a paid editor refer grave concern propos chang term use describ edit """"deception"""" allow anyon make accus editor time imposs editor prove not receiv form benefit exampl """"benefit"""" which emf tri obfusc peopl notic expans propos includ thing like receiv shirt meal ani """"money, good services""""). unfortun great deal handwav paid edit littl evid greater bias edit paid edit not larg number articl creat latest paid edit """"scandal"""" still present mani delet still easili met notabl standard good faith editor receiv sort benefit reward work wikipedia nobodi yet demonstr peopl paid wors edit wikipedia peopl paid meanwhil lot evid peopl want push point view hesit accus editor paid otherwis serious conflict interest (q.v., arbcom archiv propos one tool arsenal peopl motiv go oppon absolut noth improv project a",0
1470,pleas add commerci link for link privat websit wikipedia wikipedia vehicl advertis mere collect extern link are howev encourag add content instead link encyclopedia see welcom page learn more thank talk,0
1471,a octob dutch yes band play parad yes parad still take war text publish articl doubt poor enough contradict sourc claim pakistani naval offic claim pakistani naval offic quot indian perforc offic confirm claim perforc pilot made attack articl written indian offic check yet claim side repli poor a wp:idontlikeit a wp:ididnthearthat. word controversi repres clash claim sinc citat mention refut yet indian sourc claim it controversi come back basi argu upon a,0
1472,"a seem subject real war just click """"history"""" offens comment delet of ever possibl carri nov discuss matter without sling mud other a",0
1473,a tor email give specif author replac ought keep it chatme! a,0
1474,say leav till episod air direct confirm,0
1475,mention michael pagan incid incid involv michael pagan mention,0
1476,non-not krakatoakatie== turd briana dump articl alison crawford odd even auk know is hard get fact non-not maggot like go around polic wikipedia play pretend notabl yourselv fuck experi rest u make wikipedia general le effect use wikipedia visitor general of,0
1477,turbo jet connect err turbo jet lillian featur first episod epiderm tv seri tv,0
1478,translat much clumsi dude want suvorov name known english speaker,0
1479,hi john adam add yahoo readysetgo@yahoo.com,0
1480,move the space oper squadron,0
1481,seepag protect hey notic protect seepag locat here user:chicken. retir tag retir back young pleas unprotect it thankyou. chicken,0
1482,thank experi wikipedia test work revert remov pleas use sandbox test may want do take look welcom page learn contribut encyclopedia link edit revert found here link believ edit revert pleas contact me talk contrib a,0
1483,of januari dutch thank lot matt... again jan of,0
1484,redirect talk:dracula a spanish-languag film,0
1485,sure thing welcom talk,0
1486,redirect talk:cam ranch base,0
1487,"it complic date first composit almost certain juli a choral version use male chorus cantus firmus"""" vocal line follow pure instrument version novemb memori servic promin mason the mason funer music juli entri written novemb sinc event the deaths/funer music list along it mozart catalogu list mem ahead key written octob sequenc one sever clue wrote month proceed octob categori month novemb enter mfume not wrote piec juli a least choral version version near ident choral version essenti mem chorus for part copi mozart themat catalogu mozart mistaken (?) enter key juli also rather octob least enter sequenc piec correct key key evid get lengthi complic sequenc piec catalogu plus mention mem novemb suffici evid origin music mem compos novemb version done novemb near ident first one date music correct omit first lesser event elev visit mason master august matchup work catalogu novemb list import event death mason brother novemb perform again event set music (essentially), compos prior key correct list juli mason ceremoni august import event the death mason brother accompani entri written novemb due administr procrastin mozart part mozart normal enter music catalogu repeat entri essenti music differ event purpos word themat catalogu primarili book music a event even though also list event person opera etc along it exampl one opera reviv produc citi first time list catalogu would event-driven catalogu matchup work catalogu evid sometim novemb after novemb the and mason die list music compos juli list event death men set music event import event list catalogu catalogu slight mess page most correct piec list correct sequenc a may import mozart list correct date someon say juli must mistake"""", need duck line explain list mem prior octob piec list novemb """"mistake"""" theori pushbutton eject seat case carri extrem one could claim beethoven wrote mfume scholar mistaken believ mozart handwrit score catalogu """"july"""" mistak prove it think juli correct great deal evid back a first piec evid mozart said catalogu web page articl come short dave morton a",0
1488,look pretti good now issu might would nice refer histori section see particular reason distrust it such feel make break articl good job,0
1489,"a know anyth turkish communiti germani categori one countri categor accur mean done categori countri also warn revert war behav like yourself obvious disrupt user includ villag hungarian major categori see reason includ settlement there moreov settlement vojvodina popul mani ethnic group make even mislead describ settlement exclus hungarian communities"""". pleas stop revert war disrupt behavior ... a",0
1490,thank support folk,0
1491,former khwarazmian turk stay undo chang khwarazmian persian stay accept ...,0
1492,respect germani regard brother coldblood warrior u ...,0
1493,yup go without say import thing regard rfcs conduct rfcs proper word first place except alreadi rfcs subject clear unambigu conclus previous rfcs properly-word either,0
1494,a sprout again go report you pleas stop use person name talk a,0
1495,rage nomin delet insan voic opinion wikipedia:articl deletion/rpg,0
1496,"way fatti edit summari fine talk page hard necessari edit summari explain do necessari talk page editor simpli read comment ok shortbusser, get along now ...",0
1497,"a acupressur a tradit chines medicin (tcm) technique""""""",0
1498,a hey problem thank watch inform correct alreadi there care edit summari thank vigil go work know best wish graham talk a,0
1499,"reason insert neutral tag much funni request fact obicanib salt resort milit due sympathi indian tamil sinhales govern cruel action indian tamil sinhales a indian tamil a acc act sinhales a standard better say hurt aryan barbarian discrimin india sinc salt unabl reach aryan india salt rais arm sinhales also aryan section give refer tamil get hurt includ them pleas give refer tamil heritag side sinhales kingdom(with slt). insert articl let know tamil drop colon land major issu sinc clear relationship sinhales expel a drop claim conflict start appear sinc a let know need start section war crime parti let know need includ genocid parti know genocid latt templ tooth,muslim church secret tree kent dollar farms,... of merg list",0
1500,dalai lama ad {{cleanup-ipa}} tag articl dalai lamar refer to?(talk!),0
1501,hot chick like guy but bowl,0
1502,go away go spread croatian fascist cathol propaganda croatian wikipedia here want world fed synod crimin croat,0
1503,"also ladi penelop ignor the', first real one found ladi edward fitzgerald give correct titl howev would agre like titl english",0
1504,a tricki me brit a a,0
1505,honest nope,0
1506,"a of august a (utc)""",0
1507,stop douchebag prick monkeynut.,0
1508,yin chang kelli richard miracmichi centr miramichi bay due vine run real name also kelli clanci king chang too,0
1509,a articl nomin delet a result discuss redirect school district delta,0
1510,"person like hidden list think take inact guy like jose kidron scott spiezio, jay gibbon etc agre low next includ tie player hidden list",0
1511,"yes find tiresom too want word say """"requested"""". word auk web site consortium say clear this site select preserv british library."""" therefor feel quot exact word consortium web site entir accept ... a",0
1512,"a absolut differ howev definit celibaci abstain desire,"""" rather from dictionari a unmarri status a chastiti abstain sexual relat a religi vow asexu person could certain take part religi call tradit involv celib life a",0
1513,"from milf get al.]: wa marco believ mani discuss religion past person report note."""" sonata (ibid.) note keep mind memoriam.""",0
1514,dare research know,0
1515,"a way refer alexand great macedon make pass refer """"cleitus, king dardani"""". administr take serious flimsi refer noth kosovo a name introduc much much later centr dardani). edit noth chauvinist attempt prove continu exist a",0
1516,well document record prov behavior subject israel author time futur lectur editor proper improp behavior,0
1517,"top head diomed youngest king among greek conting troy ajax experienc warrior ajax role armi often defens use hold line wherea diomed lion-like', go look combat ajax consist refer second greatest warrior troy iliad made somewhat confus book a ajax defeat diomed fight-in-arm funer game ajax mani way paragon fighting-virtu without great divin favour take far hope help some",0
1518,"a quit whine uncivil two charact similar provid proof edit revert everi singl time not concern strong similar durham red pretti obvious look pic prof it would realli need sourc said the charact wayn bloodrayn inspir durham red"""". justic serv a",0
1519,get block ????????????????????,0
1520,actual think it realli know rule map cannot think anyon specif good either tri copyright help desk hope someon realli know stuff answer question quick say want use map whatev articl go put in know licens are aha sorri end help,0
1521,fri base recent comment anil thought might find interest,0
1522,a edit make balanc would agre person found guilti misrepres human right victim list known for assist human right victim,0
1523,advis public respond comment call liar left littl choic,0
1524,good effort appropri earli articl repeat feb materi le tend introduct sorri,0
1525,may true a sentenc question say a statement need explicit attribut text sinc interpret,0
1526,a meant regardless time taken given protein transport amount either direct say glucos transport protein cannot chang configur back without transport revers direct concentr either side ever chang exp particl outsid insid protein whenev go in chang outsid insid never get outsid insid protein substrat bind spot insid mean cannot bind new particl outsid without first transport molecul insid back out turn back out in claw a,0
1527,a thank much wish you someon say smiley-tool suitabl wikipedia exact other becom main goal mediawiki which seem conclus declin user-numbers). see exampl mw:social tool user like here best wish a user perihelion a,0
1528,"a consid hour fact involv peopl respond yet think hold archiv till tomorrow probabl first exist thread one subsequ thread followup question though format posit statement take individu collect mayb """"pro"""" """"con"""" regard certain issu someth els a",0
1529,a a palestinian civil war volunt work hard translat made great job nevertheless nuanc alway easi translat sometim skip sentenc understand french a time modifi mean for understand english absenc main articl may bias inform think would worth could read back this regard a,0
1530,satisfi conclus and also that even though say anyth clear see might opinion tip longer make sockpuppetri accus edit summari hope bursar listen recommend also stop harass edit war,0
1531,[user:ryancahn|ryancahn]] a pm august a,0
1532,gawker lick ball too,0
1533,of sophistri word game of contradict introductori paragraph polici tri cite go discus further,0
1534,"a yin rainbow dash rollback support editor make chang good faith belief order push point ms talk page i person want challeng higher rank articl yet unfortun consensus would face lot biasness. take lower rank articl work up."""" ... a",0
1535,"a amus despit start discuss chang chose revert edit summari say see talk despit fact comment talk time appar discuss appli you made unwarr revert without discuss pop tell use talk page thought err clear label head articl enforc general rule may fallen foul due number stupid revert small number editor articl like remov ref link scientif paper paper first mention para paper tri buri down).""",0
1536,a request unblock grant follow reason(s): cruz day shot nina request handl by ... ... a,0
1537,"a err ... ignor guy say """"cytologist"""" dutch accent boot lola a",0
1538,know... ... ugli piec shit serious question,0
1539,racist thing ever heard...,0
1540,well noth done it final cut intro larg suggest abov took redund sure address concern rubinstein pleas edit see fit though think step right direct,0
1541,"a symbol resign date note joseph ratzinger, ex-conscript adolf hitler youth announc resign pope benedict xvi februari the a benedict ariadn adolf osnabrck feast daycahol onlin februari fest day http://www.catholic.org/saints/f_day/feb.php. mayb should ad hid biographi wp:synth close conclus combin sourc list two curios nummersechs, note anyth beyond sort weird coincid talk of april a dutch pleas read wp:synth say combin materi multipl sourc reach impli conclus explicit state sourc one reliabl sourc say a anoth reliabl sourc say by join by togeth impli conclus cd mention either sourc emphasi mine get that implic announc resign februari a februari feast day saint loosely-rel name therefore...? talk of april a dutch sinc agre inediblehulk a elizium comment put also discuss talk page everyth pope doe speak write act etc think well advanc symbol basi deni that without argument better lawyer point view mean complet ignor essenc pope role cathol world a christian church way french anglo-saxon, learn german school (j. ratzing germani believ quit author write that sinc franc recogn romeo first daughter say happen day feast let reader draw conclus otherwis wp:synth. know german quit well taken year german class one year college-level. aunvatalk a contrib note februari the cathol church also celebr note dame de lourd aka ladi lourd southwest franc anoth non relat of coincid franois-bernard michel co-presid lourd medic bureaucomit medic intern de lourd in french http://fr.lourdes-france.org/approfondir/guerisons-et-miracles/composition-comite-medical-international-lourdes, presid also french nation academi medicin year a also member academ doe beaux-arts, presid twice institut de franc chair xiii creat a good rush sort thing peopl know superfici similar spawn spurious statement caprici coincid careless conjectures"""". talk neither a logic by notabl cd sourc like put predict nostradamus aztec calendar togeth get result pleas keep articl of m.p.schneider,lc (parlemus a fecit a",0
1542,interest subject pleas read wikipedia:reference_desk/humanities#abbas_and_the_armenians. think articl move lion erudit repli agre abbess deport first great tragedi histori armenian peopl --,0
1543,check imag out see imag upload watanuki.jpg ... judg histori entri ad person creat entri mayb panel manga scan me,0
1544,"a wait first said """"troyano book state two arch alconetar site origin span m)"""", write this text caption impli arch left origin roman arch two recent"""". case bridg would roman segment arch bridg all would it romano somewher write wooden low span/ris ratio bridg roman also constitut segment arch despit superstructur wood stone a",0
1545,a new sign sup a,0
1546,a would sport coach american a a,0
1547,"a april dutch agre anjouli paragraph bookend discuss think quit self-explanatori enough give guidanc futur editor four point would like refin propos refin wp:bio. everyon pleas comment bullet point a talk follow twp polici wikipedia:not (people)#list peopl say the list limit notabl peopl alreadi wikipedia articl could plausibl one per guideline."""" entri clear non-not spurious delet a talk person notabl former student list articl alreadi (i.e. red link check see person use articl delet notabl case delet person notabl list otherwis may stay list but spirit twp polici attribut reliabl sourc footnot attach name citat show local connect footnot appropri put """"fact"""" tag say citat need a talk person notabl former student list articl articl mention local connect editor ad notabl citizen list add statement person articl document local connect attribut reliabl sourc statement person articl appropri put """"fact"""" tag person entri list show articl miss evid school connect perhap person belong list seem like school connect delet name list a talk person notabl former student list articl articl mention local connect attribut reliabl sourc appropri put """"fact"""" tag unsupport mention local connect case tag name list a talk of a",0
1548,"may dutch vandal giorgion chiellini, pleas stop second warn of",0
1549,unfair enolog certain could make point without type word....,0
1550,come on mani unblock me,0
1551,trivia trivia section possibl confus thing seen day realli know say tri fix it,0
1552,"a jacob """"jack"""" turin seem worth make stub document nick name asa includ press releas a worth document document becom avail via folium request exampl use know is http://www.nsa.gov/public_info/_files/cryptologic_quarterly/youve_got_to_go_by_the_rules.pdf a",0
1553,inaccur entri wikipedia aim accur possibl,0
1554,block page say add page go someon fix get power corrupt idiot stop stalk me,0
1555,articl it publish eurogamer.,0
1556,plano edit base real event anymor vandal edit banned!se talk page option use sandbox make joke revert,0
1557,hamsheni thank head up revert it pretti much revert work,0
1558,trivial point laughter discredit multitud way,0
1559,gari pittman faggot,0
1560,never told direct go die also tell someon go die know person go go kill unless suicid sure not,0
1561,"a hi insert non-format text here... redirect insert text]]""",0
1562,dude guy must crack instead block idiot tri delet page without legitim reason block out moron like wikipedia surviv mark word could care le account boycott mad site,0
1563,talk:co-freemasonri left messag there fail see tri argu point bottom tri side you tri understand point argument provid feedback thank arden,0
1564,way forgiv action past sorri forgiv earlier a go bid tad far sorri that,0
1565,a sorri post read attack attack ogden person confus discrep doctrin posit ogden plain state lid howev posit seem far church teach doctrin believ ogden fair ask whether status lid one activ faith judgement intend base activ help clarifi prov balanc issu talk a,0
1566,a ...and restor it read lot materi subject game decis would better decid consensus assum articl ever get enough traffic spark discuss notabl filmmak enough medium coverag game give leonin fifteen minut ever come vote a one person around for sinc involv wikipedia minim a put merger a,0
1567,a well say lead text sauk insolv law a certain want claim authorit world simpli want write principl roy goodi propos put two text ukr a,0
1568,of {{wpphilippines| class=start a importance=low,0
1569,daili close valu one know find daili close valu and chang preced close mejia go back a particular interest know mejia ever daili chang a point preced day word day chang of point one day next thank a a,0
1570,help!!!!!!!!! know see someth realli weird happen ad via patch info warsaw look go anyth me,0
1571,fanboy seem gama die hard fan gama hire promot keep remov negat aspect show(although caruso myself cannot afford build hairdo fan site stop bug wikipedia studi hard work hard mayb someday host extravag hairdo fan site lola vocal uproar shakier fan much ignor delet talk refer much better remov entir articl proper referenc either talk refer tri cool hairdo rememb googl a search engin see result see gargantuan negat comment tv good comment zaido. overwhelm wonder articl quick vandal hairdo realli phenomen lola truth exceed obvious hairdo s*cks!! eat it sleep it live it all honest okay god watch godless,0
1572,kind jerk,0
1573,never agre anyth said would agre disagre ensur understand action take inappropri anoth user warn below hope take heart stop remov content tri speedi delet articl a,0
1574,"a januari dutch wikipedia decid semi-protect total protect generic conceptu confus stupid must reach top wors becom encyclopedia guard total conceptu confus forc must world histor record stupid editor wikipedia realli agre protect conceptu confus like """"yes, articl claud mess protect mess also protect propag mess concept encyclopedia allow resolv contribut confus anywher encyclopedia cladist encyclopedia like conceptu messes"""". protect would least typic cladist take care cladist actual deni =). mat present ... of a",0
1575,hi directori forum discus editor polit belief like communist fascist/nazi movement you true past tito consid hero sinc fall berlin wall western point view differ pictur emerg wikipedia reflect refer encyclopaedia britannica a bbc-history. dramat chang articl now research done concern aftermath wow yugoslavia look good,0
1576,debit mae west chang sourc assert far tell also incorrect format chang revert regard,0
1577,"a attent zip address a regist america onlin gaol share multipl user see awol rang comment left page may receiv user zip appear irrelev caution use block zip revert contribut without check unregist user oper address note zip address machin zip address proxi server communic browser wikipedia server proxi share among thousand awol user frustrat irrelev comment appear here avoid creat account yourself talk a contrib a [/wiki/special:checkuser?user= checkuser] a [/wiki/special:log/move?page=user: page move a block a [/wiki/special:log/block?page=user: block log a edit counti pleas note awol user often chang zip address page load whorish warn messag left page probabl receiv intend user edit jeff gordon recent edit jeff gordon differ revert autom bot attempt recogn repair vandal wikipedia articl bot revert legitim edit pleas accept humbl creator apolog a bring attent bot owner may abl improv behavior i'm frequent ask questions'' bot warn of attent zip address a regist america onlin gaol share multipl user see awol rang comment left page may receiv user zip appear irrelev caution use block zip revert contribut without check unregist user oper address note zip address machin zip address proxi server communic browser wikipedia server proxi share among thousand awol user frustrat irrelev comment appear here avoid creat account yourself talk a contrib a [/wiki/special:checkuser?user= checkuser] a [/wiki/special:log/move?page=user: page move a block a [/wiki/special:log/block?page=user: block log a edit counti pleas note awol user often chang zip address page load whorish warn messag left page probabl receiv intend user thank experi wikipedia test work revert remov pleas use sandbox test want do take look [[wikipedia:welcome, new",0
1578,pleas observ wp:npa wp:agf.,0
1579,page remov messag user page done anyth,0
1580,"a massacr note kent state massacr redirect page other similar massacr histori a wherein govern forc murder civilian protest govern polici a term """"[such such massacre"""". legitim reason asid sensit extremist viewpoint unit state continu call articl kent state shootings"""". chang kent state massacre"""". cheap acknowledg lead paragraph insuffici would appreci discuss move initi move soon enough a",0
1581,dynam zip zip dynam assign chip server road runner custom particular area,0
1582,uhf yeah doe dumbass. ever edit articl make worrier harder understand,0
1583,fair use rational fur image:image:psh logo.gif. pleas solv this given psi mintag today thank year,0
1584,a hello welcom wikipedia appreci contribut sinc english wikipedia cannot accept text languag howev origin articl perhap would like translat english want contribut a contribut welcom a wish articl translat english make request wikipedia:translation. may also enjoy becom part wikipedia effort coordin across differ languag inform take look wikipedia polici guidelin happi edit to a,0
1585,one understand benefit honey visa high toxic sap explain detail sap extrem detriment human health caus sever problem time purport still much appreci beekeep franc mean compound permeat whole plant sap toxic small quantiti somehow complet absent flower so possibl bee decompos chemic honey product explain,0
