,text,threat
700,fuck you fuck twat dare insult me thu am!!! go jerk fat twat dickhead....fuck you fuck twat dare insult me thu am!!! go jerk fat twat dickhead....fuck you fuck twat dare insult me thu am!!! go jerk fat twat dickhead....fuck you fuck twat dare insult me thu am!!! go jerk fat twat dickhead....fuck you fuck twat dare insult me thu am!!! go jerk fat twat dickhead....fuck you fuck twat dare insult me thu am!!! go jerk fat twat dickhead....fuck you fuck twat dare insult me thu am!!! go jerk fat twat dickhead.... love really!!!!!!!!,1
701,fuck you fuck you uncivil continu wast time continu write messag care wikipedia use user page fuck hahahahhahahaha! suicid pleas dirti dust societi user page cannot delet fuck hahahah lamer wast peopl time crime sue mind,1
702,one messag like this get stab death warn motherf@#&%er! ...,1
703,let tell littl mani person attack find beat hell you glad know live find you,1
704,back fuck off take year old as buy fuck welkin stop tri involv someth understand act like internet tough guy get anoth post you track parent talk them a a,1
705,fuck wikipedia fuck leftist liber faggot-lov jew communist run fuck piec shit websit,1
706,whoever delet shit wikipedia small dick loser mother whore,1
707,leav fuck page way edit as,1
708,like fuck,1
709,write myself made account make page person notabl know person is mean relev fuck as go jack wikipedia more serious cannot find someth better life bet a singl momus basement,1
710,armadillofromhel fuck faggot stop destroy yes mine discuss page want get rid someth let fuck it saw it back fuck off ruin wikipedia me asshole.,1
711,pathet littl fuck call peni film jobless wikipedia bitch,1
712,pure troll hi moron hi moron hi moron hi moron hi moron hi moron hi moron hi moron hi moron hi moron hi moron hi moron hi moron hi moron hi moron hi moron hi moron hi moron hi moron hi moron hi moron hi moron hi moron hi moron hi moron hi moron hi moron hi moron hi moron hi moron hi moron hi moron hi moron hi moron hi moron hi moron hi moron hi moron hi moron hi moron hi moron hi moron hi moron hi moron hi moron hi moron hi moron hi moron hi moron hi moron hi moron hi moron hi moron hi moron hi moron hi moron hi moron hi moron hi moron hi moron hi moron hi moron hi moron hi moron hi moron hi moron hi moron hi moron hi moron hi moron hi moron hi moroni moron hi moron hi moron hi moron hi moron hi moron hi moron hi moron hi moron hi moron hi moron hi moron hi moron hi moron hi moron hi moron hi moron hi moron hi moron hi moron hi moron hi moron hi moron hi moron hi moron hi moron hi moron hi moron hi moron hi moron hi moron hi moron hi moron hi moron hi moron hi moroni moron hi moron hi moron hi moron hi moron hi moron hi moron hi moron hi moron hi moron hi moron hi moron hi moron hi moron hi moron hi moron hi moron hi moron hi moron hi moron hi moron hi moron hi moron hi moron hi moron hi moron hi moron hi moron hi moron hi moron hi moron hi moron hi moron hi moron hi moron hi moroni moron hi moron hi moron hi moron hi moron hi moron hi moron hi moron hi moron hi moron hi moron hi moron hi moron hi moron hi moron hi moron hi moron hi moron hi moron hi moron hi moron hi moron hi moron hi moron hi moron hi moron hi moron hi moron hi moron hi moron hi moron hi moron hi moron hi moron hi moron hi moron,1
713,"man piec shit piec shit,you fuck yr old even have brainm.john lena wrestle,you bitch.did cd wrestle?h wrestler,ps. boon like boon understand you insult favourit wrestler bitch go get block edit right now,got it!!!!",1
714,fuck stupid raspi armhol,1
715,well suck ball gay fuck wikipedia censor give fuck feel give fuck grammar nazism edit summari front page discussion... go call foul everi grammar mistak discuss section articl correct chang did play repeatedly... further surf limb boards... general consensus insur mutat virus get back futur fuck think scientist sit there appear year later die age bit came back sat next person releas virus... realli think began insur thirti year later age singl bit becam scientist work time travel fuck hypocrit,1
716,fuck armhol termin youtub account never forgiv you queenzeppelin,1
717,"a vandal would ignor messag normal and ignor mean let live earth would call edit """"vandalize"""" obvious not mere ad categori thought appropri absolut intent """"vandalize"""". could said someth agre with even someth peopl edit agre with could direct """"warning"""" veri real threat like the next time threaten someone"""". call want petti """"vandalizer"""". usual feel lazi cross intern line one thing glad tell sign death warrant long guy revert countri look forward pain death short a",1
718,"""fffff muumuu cccccc kkkkkk ===== you of usu cd okay fluff muumuu cccccc kkkkkk ===== you of usu cd okay fluff muumuu cccccc kkkkkk ===== you of usu cd okay fluff muumuu cccccc kkkkkk ===== you of usu cd okay fluff muumuu cccccc kkkkkk ===== you of usu cd okay fluff muumuu cccccc kkkkkk ===== you of usu cd okay fluff muumuu cccccc kkkkkk ===== you of usu cd okay fluff muumuu cccccc kkkkkk ===== you of usu cd okay fluff muumuu cccccc kkkkkk ===== you of usu cd okay fluff muumuu cccccc kkkkkk ===== you of usu cd okay fluff muumuu cccccc kkkkkk ===== you of usu cd okay fluff muumuu cccccc kkkkkk ===== you of usu cd okay fluff muumuu cccccc kkkkkk ===== you of usu cd okay fluff muumuu cccccc kkkkkk ===== you of usu cd okay fluff muumuu cccccc kkkkkk ===== you of usu cd okay fluff muumuu cccccc kkkkkk ===== you of usu cd okay fluff muumuu cccccc kkkkkk ===== you of usu cd okay fluff muumuu cccccc kkkkkk ===== you of usu cd okay fluff muumuu cccccc kkkkkk ===== you of usu cd okay fluff muumuu cccccc kkkkkk ===== you of usu cd okay fluff muumuu cccccc kkkkkk ===== you of usu cd okay fluff muumuu cccccc kkkkkk ===== you of usu cd okay fluff muumuu cccccc kkkkkk ===== you of usu cd okay fluff muumuu cccccc kkkkkk ===== you of usu cd okay fluff muumuu cccccc kkkkkk ===== you of usu cd okay fluff muumuu cccccc kkkkkk ===== you of usu cd okay fluff muumuu cccccc kkkkkk ===== you of usu cd okay fluff muumuu cccccc kkkkkk ===== you of usu cd okay fluff muumuu cccccc kkkkkk ===== you of usu cd okay fluff muumuu cccccc kkkkkk ===== you of usu cd okay fluff muumuu cccccc kkkkkk ===== you of usu cd okay fluff muumuu cccccc kkkkkk ===== you of usu cd okay fluff muumuu cccccc kkkkkk ===== you of usu cd okay fluff muumuu cccccc kkkkkk ===== you of usu cd okay fluff muumuu cccccc kkkkkk ===== you of usu cd okay fluff muumuu cccccc kkkkkk ===== you of usu cd okay fluff muumuu cccccc kkkkkk ===== you of usu cd okay fluff muumuu cccccc kkkkkk ===== you of usu cd okay fluff muumuu cccccc kkkkkk ===== you of usu cd okay fluff muumuu cccccc kkkkkk ===== you of usu cd okay fluff muumuu cccccc kkkkkk ===== you of usu cd okay fluff muumuu cccccc kkkkkk ===== you of usu cd okay fluff muumuu cccccc kkkkkk ===== you of usu cd okay fluff muumuu cccccc kkkkkk ===== you of usu cd okay fluff muumuu cccccc kkkkkk ===== you of usu cd okay fluff muumuu cccccc kkkkkk ===== you of usu cd okay fluff muumuu cccccc kkkkkk ===== you of usu cd okay fluff muumuu cccccc kkkkkk ===== you of usu cd okay fluff muumuu cccccc kkkkkk ===== you of usu cd okay fluff muumuu cccccc kkkkkk ===== you of usu cd okay fluff muumuu cccccc kkkkkk ===== you of usu cd okay fluff muumuu cccccc kkkkkk ===== you of usu cd okay fluff muumuu cccccc kkkkkk ===== you of usu cd okay fluff muumuu cccccc kkkkkk ===== you of usu cd okay fluff muumuu cccccc kkkkkk ===== you of usu cd okay fluff muumuu cccccc kkkkkk ===== you of usu cd okay fluff muumuu cccccc kkkkkk ===== you of usu cd okay fluff muumuu cccccc kkkkkk ===== you of usu cd okay fluff muumuu cccccc kkkkkk ===== you of usu cd okay fluff muumuu cccccc kkkkkk ===== you of usu cd okay fluff muumuu cccccc kkkkkk ===== you of usu cd okay fluff muumuu cccccc kkkkkk ===== you of usu cd okay fluff muumuu cccccc kkkkkk ===== you of usu cd okay fluff muumuu cccccc kkkkkk ===== you of usu cd okay fluff muumuu cccccc kkkkkk ===== you of usu cd okay fluff muumuu cccccc kkkkkk ===== you of usu cd okay fluff muumuu cccccc kkkkkk ===== you of usu cd okay fluff muumuu cccccc kkkkkk ===== you of usu cd okay fluff muumuu cccccc kkkkkk ===== you of usu cd okay fluff muumuu cccccc kkkkkk ===== you of usu cd okay fluff muumuu cccccc kkkkkk ===== you of usu cd okay fluff muumuu cccccc kkkkkk ===== you of usu cd okay fluff muumuu cccccc kkkkkk ===== you of usu cd okay fluff muumuu cccccc kkkkkk ===== you of usu cd okay fluff muumuu cccccc kkkkkk ===== you of usu cd okay fluff muumuu cccccc kkkkkk ===== you of usu cd okay fluff muumuu cccccc kkkkkk ===== you of usu cd okay fluff muumuu cccccc kkkkkk ===== you of usu cd okay fluff muumuu cccccc kkkkkk ===== you of usu cd okay fluff muumuu cccccc kkkkkk ===== you of usu cd okay fluff muumuu cccccc kkkkkk ===== you of usu cd okay fluff muumuu cccccc kkkkkk ===== you of usu cd okay fluff muumuu cccccc kkkkkk ===== you of usu cd okay fluff muumuu cccccc kkkkkk ===== you of usu cd okay fluff muumuu cccccc kkkkkk ===== you of usu cd okay fluff muumuu cccccc kkkkkk ===== you of usu cd okay fluff muumuu cccccc kkkkkk ===== you of usu cd okay fluff muumuu cccccc kkkkkk ===== you of usu cd okay fluff muumuu cccccc kkkkkk ===== you of usu cd okay fluff muumuu cccccc kkkkkk ===== you of usu cd okay fluff muumuu cccccc kkkkkk ===== you of usu cd okay fluff muumuu cccccc kkkkkk ===== you of usu cd okay fluff muumuu cccccc kkkkkk ===== you of usu cd okay fluff muumuu cccccc kkkkkk ===== you of usu cd okay fluff muumuu cccccc kkkkkk ===== you of usu cd okay fluff muumuu cccccc kkkkkk ===== you of usu cd okay fluff",1
719,ban fuck mexican gay prick,1
720,fuck page!!!!!!!!!!!!!!,1
721,hey faggot suck huge dong,1
722,niggerbal delet page asshole?,1
723,motherfuck piec crap fuckhead block u,1
724,wiki freak come from first all fuck page give shit tell fuck off second program peopl use order squash peopl contribut feel like nazi too,1
725,fuck loser have noth better yuck stop edit alreadi,1
726,die person said rot hell fuck loser!!!,1
727,fuck off!!!!- of wolfkeep talk,1
728,jesus god fuck retard pathet piec shit,1
729,fuck die lola refl joke hahahahahahahaha cannot stop vandal of though,1
730,go fuck hang yourself fuck scum earth fuck asshole!,1
731,fuck greenland fuck piec shit digniti name wikipedia deserv respect everi fuck moron give jose eduardo do santo fals inform wikipedia like say born luanda hhd cpd oyez degre timbacktu. fuck communist lover way shit pan allow post wikipedia suck cock probabl trust mouth dick head,1
732,gay shit,1
733,fuck you piec shit fuck you piec shitfuck you piec shitfuck you piec shitfuck you piec shitfuck you piec shitfuck you piec shitfuck you piec shitfuck you piec shitfuck you piec shitfuck you piec shitfuck you piec shitfuck you piec shitfuck you piec shitfuck you piec shitfuck you piec shitfuck you piec shitfuck you piec shitfuck you piec shitfuck you piec shitfuck you piec shitfuck you piec shitfuck you piec shitfuck you piec shitfuck you piec shitfuck you piec shitfuck you piec shitfuck you piec shitfuck you piec shitfuck you piec shitfuck you piec shitfuck you piec shitfuck you piec shitfuck you piec shitfuck you piec shitfuck you piec shitfuck you piec shitfuck you piec shitfuck you piec shitfuck you piec shitfuck you piec shitfuck you piec shitfuck you piec shitfuck you piec shitfuck you piec shitfuck you piec shitfuck you piec shitfuck you piec shitfuck you piec shitfuck you piec shitfuck you piec shitfuck you piec shitfuck you piec shitfuck you piec shitfuck you piec shitfuck you piec shitfuck you piec shitfuck you piec shitfuck you piec shitfuck you piec shitfuck you piec shitfuck you piec shitfuck you piec shitfuck you piec shitfuck you piec shitfuck you piec shitfuck you piec shitfuck you piec shitfuck you piec shitfuck you piec shitfuck you piec shitfuck you piec shitfuck you piec shitfuck you piec shitfuck you piec shitfuck you piec shitfuck you piec shitfuck you piec shitfuck you piec shitfuck you piec shitfuck you piec shitfuck you piec shitfuck you piec shitfuck you piec shitfuck you piec shitfuck you piec shitfuck you piec shitfuck you piec shitfuck you piec shitfuck you piec shitfuck you piec shitfuck you piec shitfuck you piec shitfuck you piec shitfuck you piec shitfuck you piec shitfuck you piec shitfuck you piec shitfuck you piec shitfuck you piec shitfuck you piec shitfuck you piec shitfuck you piec shitfuck you piec shitfuck you piec shitfuck you piec shitfuck you piec shitfuck you piec shitfuck you piec shitfuck you piec shitfuck you piec shitfuck you piec shitfuck you piec shitfuck you piec shitfuck you piec shitfuck you piec shitfuck you piec shitfuck you piec shitfuck you piec shitfuck you piec shitfuck you piec shitfuck you piec shitfuck you piec shitfuck you piec shitfuck you piec shitfuck you piec shitfuck you piec shitfuck you piec shitfuck you piec shitfuck you piec shitfuck you piec shitfuck you piec shitfuck you piec shitfuck you piec shitfuck you piec shitfuck you piec shitfuck you piec shitfuck you piec shitfuck you piec shitfuck you piec shitfuck you piec shitfuck you piec shitfuck you piec shitfuck you piec shitfuck you piec shitfuck you piec shitfuck you piec shitfuck you piec shitfuck you piec shitfuck you piec shitfuck you piec shitfuck you piec shitfuck you piec shitfuck you piec shitfuck you piec shitfuck you piec shitfuck you piec shitfuck you piec shitfuck you piec shitfuck you piec shitfuck you piec shitfuck you piec shitfuck you piec shitfuck you piec shitfuck you piec shitfuck you piec shitfuck you piec shitfuck you piec shitfuck you piec shitfuck you piec shitfuck you piec shitfuck you piec shitfuck you piec shitfuck you piec shitfuck you piec shitfuck you piec shitfuck you piec shitfuck you piec shitfuck you piec shitfuck you piec shitfuck you piec shitfuck you piec shitfuck you piec shitfuck you piec she,1
734,go fuck cunt...,1
735,hey think armhol love fuck monk day bitch stop fuck now!!!!!!!!!! got bitch,1
736,lili homi front cruz put as fuck gas chamber bitch,1
737,countri shit!!! pollut world!!! allah akbar!!!,1
738,dare abus autograph page fag!!!! dieeeee!!! you gangsta rape got noth rock!!! fail,1
739,dick head dare go around delet peopl articl kind retard spend time computer... you nerd,1
740,"fuck hi netmonger, go edit wikipedia more care whether mystic warpath lahiru_k a fact raven one suspect arsath, seem good pal wikipedia fuck complic me sri lanka day concentr book inact wikipedia want wast anymor time thank circl untrustworthi friend fuck you!!!",1
741,swear fuck christ leav alone!!!!!!!!!!!!!!! i.t.'s. my p.a.g.e.!!!!!!!!!!!! change????? pervert stalker!!!!!!!!!!!!!!!!!!!!!!!!,1
742,die car crash fuck armhol traitor local team live near boston would cunt prefer boston team live near boston retard faggot cunt,1
743,stupid fuck mother cunt stink,1
744,go fuck notch public comput suck bitch face,1
745,fuck mother,1
746,armhol dickhead..getth staright..whatev comment add authent mr dhoti rajput..but keep delet that wherea sewag page allow written jat... badgujjar rajputs..not one ask tell gujjars.. tri remov rajput glori history..i tolerate..you mongrose.. rajput ruler india guitar cat farmer cattl herders... ourself give wrong inform world wat sort wikipedia that must taken bribe..you sucker head....,1
747,made damn person attack call vandal bud updat it dun like write rewrit damn go delet shit without replac it,1
748,go kill you go murder you go kill you go murder you go kill you go murder you go kill you go murder you go kill you go murder you go kill you go murder you go kill you go murder you go kill you go murder you go kill you go murder you go kill you go murder you go kill you go murder you go kill you go murder you go kill you go murder you go kill you go murder you go kill you go murder you go kill you go murder you go kill you go murder you go kill you go murder you go kill you go murder you go kill you go murder you go kill you go murder you go kill you go murder you go kill you go murder you go kill you go murder you go kill you go murder you go kill you go murder you go kill you go murder you go kill you go murder you go kill you go murder you go kill you go murder you go kill you go murder you go kill you go murder you go kill you go murder you go kill you go murder you go kill you go murder you go kill you go murder you go kill you go murder you go kill you go murder you go kill you go murder you go kill you go murder you go kill you go murder you go kill you go murder you go kill you go murder you go kill you go murder you go kill you go murder you go kill you go murder you go kill you go murder you go kill you go murder you go kill you go murder you go kill you go murder you go kill you go murder you go kill you go murder you go kill you go murder you go kill you go murder you go kill you go murder you go kill you go murder you go kill you go murder you go kill you go murder you go kill you go murder you go kill you go murder you go kill you go murder you go kill you go murder you go kill you go murder you go kill you go murder you go kill you go murder you go kill you go murder you go kill you go murder you go kill you go murder you go kill you go murder you go kill you go murder you go kill you go murder you go kill you go murder you go kill you go murder you go kill you go murder you go kill you go murder you go kill you go murder you go kill you go murder you go kill you go murder you go kill you go murder you go kill you go murder you go kill you go murder you go kill you go murder you go kill you go murder you go kill you go murder you go kill you go murder you go kill you go murder you go kill you go murder you go kill you go murder you go kill you go murder you go kill you go murder you go kill you go murder you go kill you go murder you go kill you go murder you go kill you go murder you go kill you go murder you go kill you go murder you go kill you go murder you go kill you go murder you go kill you go murder you go kill you go,1
749,fuckfac bastard rot hell motherfuck,1
750,bongwarrior gigant asshole. dig grandmoth shit dentur,1
751,a stop fuck spam told sock/meat puppet dozen time stop fuck spam incess spam editor page help fuck all mere continu confirm editor opinion articl valid problem editor need address well thing keep articl present signific coverag reliabl third parti sourc consid final warn tripod aka red pen doom a,1
752,peni ===d~~peni ===d~~peni ===d~~peni ===d~~peni ===d~~peni ===d~~peni ===d~~peni ===d~~peni ===d~~peni ===d~~peni ===d~~peni ===d~~peni ===d~~peni ===d~~peni ===d~~peni ===d~~peni ===d~~peni ===d~~peni ===d~~peni ===d~~peni ===d~~peni ===d~~peni ===d~~peni ===d~~peni ===d~~peni ===d~~peni ===d~~peni ===d~~peni ===d~~peni ===d~~peni ===d~~peni ===d~~peni ===d~~peni ===d~~peni ===d~~peni ===d~~peni ===d~~peni ===d~~peni ===d~~peni ===d~~peni ===d~~peni ===d~~peni ===d~~peni ===d~~peni ===d~~peni ===d~~peni ===d~~peni ===d~~peni ===d~~peni ===d~~peni ===d~~peni ===d~~peni ===d~~peni ===d~~peni ===d~~peni ===d~~peni ===d~~peni ===d~~peni ===d~~peni ===d~~peni ===d~~peni ===d~~peni ===d~~peni ===d~~peni ===d~~peni ===d~~peni ===d~~peni ===d~~peni ===d~~peni ===d~~peni ===d~~peni ===d~~peni ===d~~peni ===d~~peni ===d~~peni ===d~~peni ===d~~peni ===d~~peni ===d~~peni ===d~~peni ===d~~peni ===d~~peni ===d~~peni ===d~~peni ===d~~peni ===d~~peni ===d~~peni ===d~~peni ===d~~peni ===d~~peni ===d~~peni ===d~~peni ===d~~peni ===d~~peni ===d~~peni ===d~~peni ===d~~peni ===d~~peni ===d~~peni ===d~~peni ===d~~peni ===d~~peni ===d~~peni ===d~~peni ===d~~peni ===d~~peni ===d~~peni ===d~~peni ===d~~peni ===d~~peni ===d~~peni ===d~~peni ===d~~peni ===d~~peni ===d~~peni ===d~~peni ===d~~peni ===d~~peni ===d~~,1
753,folk suck bitch flock,1
754,"a say featur articl differ requir articl weekday whole point get citat articl meet wpm requir notic tag quit often help bring attent user particular newish user cheer seamark agre weekday seanmack. ultim goal everi articl fax qualiti satori son goal consensus among editor import inlin citat everi fact fax requir see wp:fa? section cd mummer a talk a gave link refer fuck say provid refer fucktard? well lie fuck a fucktard provid refer delet post fuck moron a fuckhol deathtard, second time citat fuckhol time display fuckhol eye teacher know someth cathol bash post alex murphi religion of of post a repli a a view bakersfield californian a a feb a leonel martinez catech teacher sister mari lou petrillo, smart scrappi nun drill u basic catholic without demean christian church religion bad sister mari lou avail teach intens lesson toler campaign peopl presidenti candid john edward within last week two blogger former north carolina senat resign hit critic conserv cathol organ anger past anti-cathol remark blogger post web accord conn melissa mcgowan amanda mayott quit group like catholic... explet delet cathol bash reinhardt post jazusamo news/activ of of post a repli a a view oregonian a a februari a a david reinhardt welcom ladi gentleman time play favourit game conserv republican what a a ."""" today special """"twofer"""" edit game ask what would happen republican tri someth like this?"""" pay attent double-standard maven multiprong question today a a a a a a republican presidenti candid hire blogmast whose write featur vile attack religion expletive-lac rant disagre here a a a republican also hire anoth blogger whose write featur similar... the cathol league"""", mighti champion ....gay bash antisemit a propaganda alert post joseph demist religion of of pm post a repli a a view talk action a a sun jun a a bruce wilson hate speech typic first line attack employ bulli bulli becom embolden eliminationalist rhetor toler societ accept lead far wors thing previous cover hate speech a see enough hate speech stun box hatecrime.org extens collect hate speech target homosexu surpris a a least one individu whose statement featur archiv a also collect antisemit rhetor a also leader promin christian right group claim fight anti-cathol bias discrimin who... catholic-bash play hot post yer news/activ of of pm dpt a repli a a view cathol leagu a a august a a bill donahu bill donahu presid cathol leagu offer follow comment today popular catholic-bash play the helen hay theatr new york must experienc hard time day otherwis would home wiki a herb aliv broadway accord varieti play claim cathol church run nazi the devil realli wear prada devil pope show time are play produc manag squeez smack mel gibson drop line now want jew treat him... unholi battl rome(mor cathol a papal bash left post kellynlan",1
755,jackass pole like him... thank hate peopl like him... thank hate peopl like him... thank hate peopl like him... thank hate peopl like him... thank hate peopl like him... thank hate peopl like him... thank hate peopl like him... thank hate peopl like him... thank hate peopl like him... thank hate peopl like him... thank hate peopl like him... thank hate peopl like him... thank hate peopl like him... thank hate peopl like him... thank hate peopl like him... thank hate peopl like him... thank hate peopl like him... thank hate peopl like him... thank hate peopl like him... thank hate peopl like him... thank hate peopl like him... thank hate peopl like him... thank hate peopl like him... thank hate peopl like him... thank hate peopl like him... thank hate peopl like him... thank hate peopl like him... thank hate peopl like him... thank hate peopl like him... thank hate peopl like him... thank hate peopl like him... thank hate peopl like him... thank hate peopl like him... thank hate peopl like him... thank hate peopl like him... thank hate peopl like him... thank hate peopl like him... thank hate peopl like him... thank hate peopl like him... thank hate peopl like him... thank hate peopl like him... thank hate peopl like him... thank hate peopl like him... a,1
